{
  "TimeOffset": 0.0, 
  "LogDataTables": [
    {
      "TimeEpoch": "Mac", 
      "TimeOffset": 0.0, 
      "FirstImageCorrelation": false, 
      "ZeroImageCorrelation": true, 
      "Name": "Peak", 
      "Files": [
        {
          "Path": [
            "140721_peakInteg_01.log"
          ]
        }, 
        {
          "Path": [
            "140722_peakInteg_01.log"
          ]
        }
      ]
    }, 
    {
      "TimeEpoch": "Mac", 
      "TimeOffset": 0.0, 
      "FirstImageCorrelation": false, 
      "ZeroImageCorrelation": false, 
      "Name": "Dlogger", 
      "Files": [
        {
          "Path": [
            "140721_datalogger_01.log"
          ]
        }, 
        {
          "Path": [
            "140722_datalogger_01.log"
          ]
        }
      ]
    }
  ], 

  "OutputFormats": {
    "csv": true, 
    "hdf": true, 
    "exel": true, 
    "json": true
  }, 
  "OutputFileBaseName": "../result/merged", 
  "HDFOptions": {
    "IncludeCHI": true, 
    "IncludeTIF": false
  }
}